subreddit,title,selftext,upvote_ratio,ups,downs,score
Sims4,I made a 50s inspired sim and I love her,"I only added pictures of my favorite outfits, which were everyday, formal, athletic, and party, but I’ll add pictures in the comments if anyone wants to see others (or I’ll make another post if I can’t comment pictures here) Should I put her on the gallery?",0.99,306,0,306
Sims4,I love the implication that he's my sims child,D,0.99,102,0,102
Sims4,"Currently obsessed with my black and gold kitchen. Also, I never knew the cabinets from Life and Death had lights. I love it more now haha",,0.94,59,0,59
Sims4,"I like to alternate between clay and alpha hair, what about you?",,0.86,15,0,15
Sims4,I love playing Woo-Who?! and watching the sims' answers lol,,0.97,59,0,59
Sims4,I love how the Ravenwood Manor turned out!🥰,,0.98,63,0,63
Sims4,I love my collection,"[82 graves](https://preview.redd.it/52kiioeg3n3e1.png?width=959&amp;format=png&amp;auto=webp&amp;s=1d99e7219856bbf8e29e877575411ee9373825a8)

",0.86,10,0,10
Sims4,"I hate to break it to you, Nyon, but you’re still a Nervous Subject","I don’t think I have even gotten a screenshot of every time this man’s actually been abducted. No babies, though, which is good because a child would also probably be considered his sibling-in-law, and that would be weird. ",0.99,118,0,118
Sims4,I hate the fears,"My sim got scared of the dark randomly. 
We go outside while confident. 
Didn’t work because he got scared too quick for it to count. 
I got him a fear-be-gone. 
He drinks it. 
The fear is gone in the sim info panel. 
He still is terrified in the dark. ",0.99,501,0,501
Sims4,"I love all the sweet little interactions that come with Lovestruck. Like, who doesn't want to see two ""bros"" eating truffles together &lt;3 ",,0.97,52,0,52
Sims4,I love my daughter 😭,I was only looking away for a second and she started standing 😭 omg I love my daughter so much! Im not a mom IRL but this gives me baby fever &gt;O&lt;,0.99,922,0,922
Sims4,Need advice on who should be my generation 3 heir. I love them both so much ,"[Jonathan Eastman](https://preview.redd.it/2aafldmadr2e1.jpg?width=854&amp;format=pjpg&amp;auto=webp&amp;s=8006e8d054f66d89693f91faa119307c1fb07567)

[Jensen Eastman](https://preview.redd.it/8246cpfddr2e1.jpg?width=705&amp;format=pjpg&amp;auto=webp&amp;s=1d978767b79d9fd47a21722f564ead7b0e01603a)

",1.0,1,0,1
Sims4,Unpopular opinion: I actually liked Journey to Batuu GP,"In fact, it was one of the only expansions where I spent hours committed to achieving the objectives. It's true that the gameplay ends up being more of the same, but I even liked the dynamics of being caught by stormtroopers and I really liked all the missions that were given to us.",0.79,39,0,39
Sims4,It's Winterfest Eve and the family are gathered by the fire watching telly. I love this game ,,0.95,20,0,20
Sims4,I love this game bc why am I on a date with Brendon Urie?,He randomly generated on my cupids corner (shout-out to gallery user @potato0890 for making him LMAO) and now I obviously have to marry him? ,0.96,109,0,109
Sims4,I love how a lot of the randomly generated townies have absolute r/tragedeighs for names.,"https://preview.redd.it/8odjvtyee41e1.png?width=289&amp;format=png&amp;auto=webp&amp;s=369d75ead9dec6ca3913365883496cf7e66f5705

I have never seen the name Addison spelled like this. Who on earth would name their kid like this??? lmao

Has anyone else had any cursed names like this in their game?",0.99,533,0,533
Sims4,Feel like I need to share because of how much I love them. ,"I recently got the lovestruck pack and wanted to make a serial dater sim, ended up matching with Morgan and they hit it off so much I psychically could not have her date anyone else. The two of them are married now and I’m working on building their generational home but I’ve been gushing over them all day. (Ignore the clipping on her shirt 💀)",0.75,16,0,16
Sims4,I hate it here,Just found out that my sim who doesn’t want children is pregnant AGAIN after JUST giving birth 2 sim days ago. I can’t even handle one!! 😩 Sim gods give me strength 💀🙏,0.79,8,0,8
Sims4,I love this game.,,1.0,150,0,150
Sims4,I love that they changed the ghost needs!,Just noticed they changed it so ghost have their own unique needs. Makes a lot more sense than them having the same needs as alive sims ,1.0,2246,0,2246
Sims4,This Honeymoon suite I made turned out great I love it 🌴♾️ gallery ID: Millbabies2000,,1.0,23,0,23
Sims4,Why do I like to put the Goths through so much...? :D,,0.95,33,0,33
Sims4,I hate guitars!!!!,"
I love the guitar skill, but it’d be awesome if the guitar didn’t change spots every time it’s played 😅😅",0.99,397,0,397
Sims4,Bea and Wolfgang finally got married. I never take sims weddings too seriously. The goofier the better. But the part I love the most is how everyone needed to sit in each other's laps at the bar. ,,1.0,24,0,24
Sims4,I love Rory Oaklow,"https://preview.redd.it/glrx4kfzyszd1.png?width=1920&amp;format=png&amp;auto=webp&amp;s=88875458a57cdb23a3727199ba6099cc5c61fa6b

she's dating my simself and I adore her",1.0,14,0,14
Sims4,got my sim into painting as a hobby to decompress. he keeps making flirty paintings for his goth gf and for some reason hes obsessed with this cat spaghetti painting? also hes SO bad at it its so cute i love him,,1.0,1208,0,1208
Sims4,I hate when they don’t register for both.,,0.99,1537,0,1537
Sims4,I love this game lol,,1.0,2408,0,2408
Sims4,What’s Don Lothario up to in your game? (I love lore),"In my game he’s absolutely wholesome obviously, he met my sim Ivy while he worked as a barista. They dated, fell in love! Now he lives with Ivy &amp; her dog Tanner in Oasis Springs ❤️✨",0.97,362,0,362
Sims4,"I Love New Pack Life And Death💀🐦‍⬛, i Love macabre trait Pose 🥰🥰🥰🥰",Do you have New Pack Life And Death?,0.95,28,0,28
Sims4,Man I love making androgynous male sims,"bro took me hours, the male face bone structure (what is it even called) are a nightmare when you want to create twinks (also I'll marry whoever recognizes him)",0.69,50,0,50
Sims4,"I love you, but you're scaring me.","My sims infant daughter just aged up, I did my usual and went into cas to give her a makeover, i.e. hair and clothes. Anyway, her mom is putting on the baby mobile to the crib and she decides to look at the trashcan next to the changing table and for reasons I don't know, this image literally freaks me out. She's doing nothing wrong but this angle sends shivers down my spine. If looks could kill...",0.98,43,0,43
Sims4,"My Sim houses would be such fire hazards in real life, but I love candles. ",,1.0,46,0,46
Sims4,I love this &lt;3,,1.0,6,0,6
Sims4,I love this game,"My vampire sim cheering her husband on as he fights their common enemy Malcolm Landgraab who is somehow standing 6 feet away from the fight he is in, that is all happening in their daughters nursery while she is sleeping soundly on her playmat directly in front of it (husband lost the fight)",1.0,12,0,12
Sims4,I Love This Small Little Family,"https://preview.redd.it/selfhzfe4syd1.png?width=1982&amp;format=png&amp;auto=webp&amp;s=1ac3b082b113c1dc05279a97f38e011acbb6bea0

I decided I wanted a single mother household. Havannah fell in love with her high school sweetheart, however, his family never approved of their relationship so when she becomes pregnant while going through nursing school. He books it out on her and their daughter's life. Now, Havannah works herself ragged trying to keep the lights on while also giving her daughter the attention and time she deserves.

Here they are on her day off dancing together. I literally LOVE them. I'm also exploring the interactive doctor career which I've never done before so that's also a fun experience for me. But I adore this little family. ",1.0,9,0,9
Sims4,Cute i like the tiger plushie,,1.0,55,0,55
Sims4,I love this,So sweet 🥹 a girl and her dog,0.99,422,0,422
Sims4,I like how versatille the Growing Together Cas is. You can dress an elder or gen z in the same itens.,,0.99,651,0,651
Sims4,Those new crying animations are so cute! And I love how they care for each other.,,1.0,239,0,239
Sims4,I hate my sims,I start to hate the sims I’ve made after a while. They are so annoying and their friends etc. are much more fun and interesting and I can’t play because of that,0.23,0,0,0
Sims4,and then i go and spoil it all by saying something stupid like ‘i love you’… &lt;3 ,,0.97,70,0,70
Sims4,I love this new moodlet ,,1.0,847,0,847
Sims4,My Sim and the Grim Reaper had twins and they finally aged up into teens. I love them!,,0.95,19,0,19
Sims4,I love my Life and Death sim!,https://preview.redd.it/8dzihes5e5yd1.png?width=1920&amp;format=png&amp;auto=webp&amp;s=d6fb4257d6f723dfa399174da6b43d909523634b,0.99,50,0,50
Sims4,"Loving the Life &amp; Death Expansion Pack so far! (Funny enough, my Sim was already a vampire who was Romantically involved with the Grim Reaper for the past year in real-time xD Her fellow Grimterns are going to be envious in the job I think) Anyways, I love Ravenwood's aesthetic and the job is fun!",,0.95,35,0,35
Sims4,"Wow Geoffrey, I love this new look on you 💅🏻 ",Sorry for the low quality but I had to share. My freegan witch was selling their fruits and veggies and Geoffrey stopped by to buy some mysterious mushrooms. I really want to incorporate him into my legacy now haha,0.92,53,0,53
Sims4,possibly unpopular opinion,"i think that if my sim is a level 10 gardener, they shouldn't automatically eat the cowplant cake. i feel like if you go through all the trouble to create an otherworldly beast in your garden, you would know what the cake is there for. they are not realistically going to think that the cake is going to help with their hunger. especially when it makes them scared of their plants!!! no hate to the game or any negative vibes, just something mild i don't agree with! happy simming everyone!",0.99,1308,0,1308
Sims4,How many siblings are in your biggest family? (I love lore too if you want to share),"All the siblings are married off, they have a combined total of 13 kids! I had to try playing a big family and I’m actually having endless fun building their history/lore 🩷 They quickly became my main family🩷 Everyone getting together warms my heart sm! 
(Left to right eldest to youngest)
Ashley 
Tia
Zayne (twin 1)
Trace (twin 2)
Aida 
Eden
Stefan
Sadie
Angel ",0.89,42,0,42
Sims4,i love it when sims do innocuous things with an unfitting moodlet,"https://preview.redd.it/py0865lds7xd1.png?width=1170&amp;format=png&amp;auto=webp&amp;s=660ec8f6c7965cb7eee1898653dbf4302e4afd0b

like girl. are u going to flirt with the eggs and toast???",0.93,23,0,23
Sims4,I’m so bad at taking pics 😂 but another one I love ,A cozy home for a granny who loves flowers!,0.99,76,0,76
Sims4,I love house clutter,,1.0,230,0,230
Sims4,I love realistic bathrooms🩷,,0.99,555,0,555
Sims4,"Bruh, I hate having a public phone number with the Get Famous Pack...","So, my Sim is a retired celebrity that I refuse to ""give up the spotlight"" on because she's the first sim I managed to max everything on. They now just own a cozy diner and spend their days writing happily. And, sometimes, they get really, REALLY, concerning phone calls from townies.",0.93,33,0,33
Sims4,I love mini goats!,"My haunted house family has two mini goats living in the house. On nice days I set them outside to frolic. On this particular occasion Axel was playing a beautiful concerto when Bam Bam screamed and passed out stiff legged right next to them. I literally LoL'd.

Axel. I love how this turned out.

",0.94,15,0,15
Sims4,"I’m built a fairy village because I love the mushrooms! I didn’t limit the packs I used but if you want to check it out, my ID is StarColeHarV. ",,1.0,114,0,114
Sims4,Does anyone else take portraits of their sims during every life stage? I like seeing how much they change :D Here's the 2 kids from my current legacy from infant to teen💗,,0.99,695,0,695
Sims4,Has to be one of the prettiest sims ive made in a long time. I love her,,0.87,36,0,36
Sims4,No one will ever understand why I love the sims.,Does anyone else do family plays and are so obsessed with them? I literally had to turn my aging off to get my sims married (they were close to turning elders 😩) I love them so bad. (My sims aren’t married YET but I just bought my wedding stories so I have a whole rp going on FOR IT.),0.96,117,0,117
Sims4,"I hate building standard gyms, so I made this one super strange and ended up loving it! Weird reclaimed urban space rave type lot",,0.99,672,0,672
Sims4,I love seeing everyone's sims for the reaper challenge. I went in a different direction and made Rose Tyler.,"https://preview.redd.it/tzv3mm3pdctd1.png?width=1920&amp;format=png&amp;auto=webp&amp;s=94ad39d53a4bbb97bd3a19629f34068c7d699982

https://preview.redd.it/7eeu9m3pdctd1.png?width=1920&amp;format=png&amp;auto=webp&amp;s=d5d25f25da50f40ae613b9cb0c4e4bf275c029b5

",0.93,46,0,46
Sims4,I love when winterfest just works ,"Gabby had her boyfriend, sister, mom, dad, niece, and friends over and it just makes me happy when they have a nice Winterfest lol ",0.97,74,0,74
Sims4,I updated the Maxis Dream Mansion and I love it!,It has something for just about everyone! I uploaded it to the gallery MamaJ1075. I've been playing with it for a couple days to get it where I'm happy. There are still a few things bugging me but I REALLY want to continue my storyline 😁😂,0.98,30,0,30
Sims4,Husbands T_T I love the my wedding pack &lt;3,,1.0,16,0,16
Sims4,"I like to play the interior decorator career from DHD.   Any suggestions on builds or creators to follow who make intentionally ""bad"" houses?",Basically the title.  As an example I love refurnishing the terrible EA builds but I've been playing this career long enough (immortal robot sim) those eventually all get renovated completely as well.  So i'm looking for housees that are functional but either sparingly furnished or badly done purposefully.  Hope this makes sense!,1.0,2,0,2
Sims4,"I like my sim John, but I hate how he looks like he's mewing 24/7. Mewing all day, mewing all night. His face is literally stuck like that. I am slightly afraid of what his kids will look like.",,0.99,847,0,847
Sims4,I hate Tomarang,"I grew up in Thailand so I was excited to play the world. Conversely, I now live in a small English village much like Henford, and I adore that world. The environment and atmosphere feels exactly right. Same with Britechester. But Tomarang has no atmosphere at all!! It functions like a ghost town and it irritates me how 3 of the 9 (!!) lots are empty. I get having a few empty lots for builders but it makes the world feel so claustrophobic when there's literally not much else. My sim living there was dirt broke and grinding and I really felt her misery honestly so at least there's that.

I think if they wanted to do a Thailand inspired pack they should've done 3 neighbourhoods - an island one like Koh Samui (which could've had festivals), a historic city one like Pattana, and a bustling modern city like Bangkok. There's so much cool nightlife in Bangkok, and especially for an APARTMENTS pack, it feels like they missed a trick.

Emptiness aside, the world just feels so drab. The paved grey streets and unplayable boats. There's none of the promised lore and whimsy. Am I missing something? I just hate it, especially for the lost potential. There's not even enough lots for a non builder like me to download other people's builds.

I haven't played Citudad Emoranda yet but its giving me the same vibes. I also dislike San Sequoia for similar reasons but I haven't really played it.",0.98,1679,0,1679
Sims4,One thing I hate about the Sims 4:,"Whenever I take my sim downtown and try to make her talk to ONE other person, other people always join in. These are some of the ugliest townies ever. I’ll have my lady trying to get to know an attractive guy at the bar then these other people butt in and ruin everything.

Is there a way to kick people out of the conversation?",0.97,301,0,301
Sims4,I love the games genetics system.,even as an infant she looks just like her mother but her father’s coloring.,0.95,23,0,23
Sims4,I hate discovery quests,,0.62,6,0,6
Sims4,(No CC) My first build in a long time! I know I'm not as good as other people here but I'm open to any critique to help me improve &lt;3 (I'm also very confused because usually I'm a better decorator than builder but here I love the outside and hate the inside!),,0.99,591,0,591
Sims4,I made a small wedding venue in del sol I love it 🤍 gallery ID: Millbabies2000,,0.95,17,0,17
Sims4,"Is there anyone who really enjoys making floor layouts who fancies doing one for this house? I've spent much too long on the outside and after about 8 tries, I hate every layout I've made for the interior lol I think I have builder's block but I really want to play as a witch's coven in here.",,0.99,115,0,115
Sims4,"I love these shots of the Bluffs, of course I added a few things too it.",,0.95,50,0,50
Sims4,I love setting scenes in the Sims lol isnt this such a mood...well sad but still a mood.,,1.0,25,0,25
Sims4,I love making Sim scenes! isnt this such a MOOD!!!!!!!!!!!!!!!!!,,1.0,12,0,12
Sims4,"My Sim pleaded with the Grim Reaper, and it worked! The twins aged up to teenagers only 2 minutes before so I like to think it was a birthday gift for them lol",,1.0,18,0,18
Sims4,"Took me a while to find my groove for this super camp Ciudad Enamorada dive bar, but I love how it turned out!",,1.0,53,0,53
Sims4,Hello! I finished building this (i think) and i like it but idk if the concept is too weird. I'll explain in the comments since i can't put too much text here. Thank you for your opinions! :D,,1.0,675,0,675
Sims4,I like to add family photos to my household to add a bit more realism,I’m not very good at them but I like to add some family photos to my households to make the house feel a bit more lived in. I wish it was easier to do photos on Xbox though! ,1.0,83,0,83
Sims4,"Sometimes I like to build really run down homes, enjoy! GalleryID: Sekyria, No CC",,1.0,66,0,66
Sims4,I gave Simeon Silversweater a makeover and am surprised by how much I like the result ,,0.81,13,0,13
Sims4,I hate the wall decorations,"I hate that there is a lot of wall decor but none of if really goes together. Everytime I redecorate a house I always dread decorating the walls cause there are very few things that will look like it belongs or fits the aesthetic I'm going for. Like the mage wall hunk for example, I'm never gonna use that in a build because it doesn't look right to have a hunk of wood sticking out the wall. The only way I can see that being used and look half way decent is if you use it on the outside of a house to try and make it look like a log cabin. 

I want more wall decor that isn't light up signs, menus, business signs, plaques or stickers. I want wall decor like mega wall hanging, festive felt flowers, pink pig copper mold, copper cow mold, wish in a dish, sunny days wall decor, Polly wants a plate tree, and goldora dove decor.

Okay I'm done with my little rant now.",0.84,13,0,13
Sims4,"I LOVE yesterday's update. First build with the new basegame swatches, this is all basegame! :D",,1.0,8172,0,8172
Sims4,I love how siblings can sleep in the Murphy bed together! It’s so cute! ,,0.84,18,0,18
Sims4,Any terrain mods/tips??? I hate that it doesn't go up to the building.,,1.0,8,0,8
Sims4,"I love this original Sims house so much, I play in it in every version of the game 🥰",,0.99,494,0,494
Sims4,I love having maternity photo shoots for my sims!,"Alexis &amp; Antonio Sloan are finally expanding the fam. Currently planning on them only having one kid, but who knows? ¯\_(ツ)_/¯ ",0.88,71,0,71
Sims4,I love hosting a big christmas party and then making the children wash all the dishes,Also this family has two children of Father Winter so it’s always a close family gathering! ,0.99,156,0,156
Sims4,"Just discovered ""Tomarang Truth"" in the gossip category. I love this option!",,1.0,88,0,88
Sims4,"M key to Map, i hate it!! ","
y’all 😭 is there anyway to disable it? does anyone genuinely hate that key shortcut as much as i do. i play an on an macbook m2 btw for context! but i never use m to go to map, i find it inconvenient and i’m more of a storyteller player so i like to use the phone to travel or click on the road. anyways, just wanted to rant and i’m curious if anyone hates it as much as me or if i’m just, a lil short tempered. anyways have a good day 😌",0.75,31,0,31
Sims4,morgyn illustration i did! i love them sm,,0.99,1381,0,1381
Sims4,"unpopular opinion, island living is my favourite pack!","my recent gameplay screenshots. i do wish the mermaid occult had more to it though.

https://preview.redd.it/dtv08bwd1umd1.png?width=3840&amp;format=png&amp;auto=webp&amp;s=9e95a285998b7ff328b8779951f6958bdb814a54

https://preview.redd.it/t4jnmcwd1umd1.png?width=3840&amp;format=png&amp;auto=webp&amp;s=907852ecbcced34454e99d278277f721a9072325

https://preview.redd.it/6wovmawd1umd1.png?width=3840&amp;format=png&amp;auto=webp&amp;s=ff7742aa52ee93f6f5f6d3fd46d2570e3dce402f

https://preview.redd.it/jfnd1awd1umd1.png?width=3840&amp;format=png&amp;auto=webp&amp;s=d966905d223c77ae8a23d92394f199ea785c2d32

https://preview.redd.it/bz3co9wd1umd1.png?width=3840&amp;format=png&amp;auto=webp&amp;s=a1d01bc790bfa558f4d32781a058073119537749

https://preview.redd.it/5w883awd1umd1.png?width=3840&amp;format=png&amp;auto=webp&amp;s=ce3e9f24023eea9852ef1dff4fd09d3920ccc494

https://preview.redd.it/c159fbwd1umd1.png?width=3840&amp;format=png&amp;auto=webp&amp;s=8fd90e710a43341f7454d86bb3130e908cb7e5dc

",0.95,76,0,76
Sims4,"Not the most talented builder, I love downloading builds from the gallery and redecorating the interior instead! Sharing my current fave:",,1.0,9,0,9
Sims4,Cowplants always look like they’re smiling and I love it! 😍🐮,,0.99,588,0,588
Sims4,I love my twin grimborns. ❤️,,0.96,42,0,42
Sims4,"I love it, so ridiculous! I didn't know ghosts could wear the pumpkins that you can carve, but I'm here for it.",,0.99,108,0,108
Sims4,"They need to more of this to most picture frames(Ik this is not a picture, but yeah), each pictures has all the frames, not specific picture tie to a specific colour frame. ALSO I LOVE THIS NEW ITEM!",,0.93,21,0,21
Sims4,"❄️Cotton Candy Winter❄️
✅NoCc/ Play tested
🌅EA ID SarahSweets
I LOVE snowy builds so of course I'm starting winter early with this dreamy pink winter wonderland. Available now on the gallery few packs used!",,0.99,58,0,58
Sims4,"The grieving moodlets are constant and at random times, i love it. The trait can be so useful for storylines",,1.0,6,0,6
Sims4,I made a 50s inspired sim and I love her,"I only added pictures of my favorite outfits, which were everyday, formal, athletic, and party, but I’ll add pictures in the comments if anyone wants to see others (or I’ll make another post if I can’t comment pictures here) Should I put her on the gallery?",0.99,300,0,300
Sims4,I love the implication that he's my sims child,D,0.99,97,0,97
Sims4,"Currently obsessed with my black and gold kitchen. Also, I never knew the cabinets from Life and Death had lights. I love it more now haha",,0.96,62,0,62
Sims4,"I like to alternate between clay and alpha hair, what about you?",,0.86,15,0,15
Sims4,I love playing Woo-Who?! and watching the sims' answers lol,,0.97,59,0,59
Sims4,I love how the Ravenwood Manor turned out!🥰,,0.98,59,0,59
Sims4,I love my collection,"[82 graves](https://preview.redd.it/52kiioeg3n3e1.png?width=959&amp;format=png&amp;auto=webp&amp;s=1d99e7219856bbf8e29e877575411ee9373825a8)

",0.93,12,0,12
Sims4,"I hate to break it to you, Nyon, but you’re still a Nervous Subject","I don’t think I have even gotten a screenshot of every time this man’s actually been abducted. No babies, though, which is good because a child would also probably be considered his sibling-in-law, and that would be weird. ",0.99,118,0,118
Sims4,I hate the fears,"My sim got scared of the dark randomly. 
We go outside while confident. 
Didn’t work because he got scared too quick for it to count. 
I got him a fear-be-gone. 
He drinks it. 
The fear is gone in the sim info panel. 
He still is terrified in the dark. ",0.99,501,0,501
Sims4,"I love all the sweet little interactions that come with Lovestruck. Like, who doesn't want to see two ""bros"" eating truffles together &lt;3 ",,0.97,53,0,53
Sims4,I love my daughter 😭,I was only looking away for a second and she started standing 😭 omg I love my daughter so much! Im not a mom IRL but this gives me baby fever &gt;O&lt;,0.99,925,0,925
Sims4,Need advice on who should be my generation 3 heir. I love them both so much ,"[Jonathan Eastman](https://preview.redd.it/2aafldmadr2e1.jpg?width=854&amp;format=pjpg&amp;auto=webp&amp;s=8006e8d054f66d89693f91faa119307c1fb07567)

[Jensen Eastman](https://preview.redd.it/8246cpfddr2e1.jpg?width=705&amp;format=pjpg&amp;auto=webp&amp;s=1d978767b79d9fd47a21722f564ead7b0e01603a)

",1.0,1,0,1
Sims4,Unpopular opinion: I actually liked Journey to Batuu GP,"In fact, it was one of the only expansions where I spent hours committed to achieving the objectives. It's true that the gameplay ends up being more of the same, but I even liked the dynamics of being caught by stormtroopers and I really liked all the missions that were given to us.",0.78,37,0,37
Sims4,It's Winterfest Eve and the family are gathered by the fire watching telly. I love this game ,,0.95,20,0,20
Sims4,I love this game bc why am I on a date with Brendon Urie?,He randomly generated on my cupids corner (shout-out to gallery user @potato0890 for making him LMAO) and now I obviously have to marry him? ,0.96,107,0,107
