subreddit,title,selftext,upvote_ratio,ups,downs,score
Sims4,Whoever is responsible for THIS. I hate you from the bottom of my heart!,,0.98,11983,0,11983
Sims4,"So I love making above ground pools, and I don't know why I’m just NOW using the new ladders for them. They go perfectly!",,0.98,9688,0,9688
Sims4,"I LOVE yesterday's update. First build with the new basegame swatches, this is all basegame! :D",,1.0,8172,0,8172
Sims4,"I built this lighthouse for a retired sailor, his writer wife and their children and I like to think they're very happy there",,0.99,7770,0,7770
Sims4,I love the new High Maintenance trait :'),,0.98,7459,0,7459
Sims4,I love to live vicariously through my sims,,0.97,6966,0,6966
Sims4,The fact that these two different birds can coexist together in this game is just hilarious,,1.0,6902,0,6902
Sims4,"I don't remember who posted giving the idea of half walls with a curtain as an entry way, but I did it, and I love it.",,0.98,6726,0,6726
Sims4,I love the fact that we can name our own songs,,0.99,5991,0,5991
Sims4,Unpopular Opinion: I hate hot townie makeovers. I want them all to look like they are two steps away from disaster.,"Yes, that jawline could cut glass and those eyes glisten like stars scattered over the gently shimmering water of a cool lagoon...

Straight to jail. 

I want my townies pear-shaped, chinless and wearing ski boots and a bridal veil to the library. I want Judith Ward to show up at an awards ceremony married to a hot dog with purple hair and no teeth. I want Vlad and his seven cats to walk past my house in speedos and a wrestling mask. 

Say no to yassification. Say YES to free spirits.

(I mean, obviously play how you want to play. For me, a lot of the fun is the chaos that randomly generates.)",0.98,5721,0,5721
Sims4,"Sometimes...I never like how the stairs are arranged in the game, but I like to improvise it like this lol",,0.99,5562,0,5562
Sims4,I love this photo my Sim took of his wife on their wedding day. Gosh darn it. 🥺❤️,,0.99,5519,0,5519
Sims4,Did my best 😊 but i like it !,,0.98,5458,0,5458
Sims4,"I like to paint dogs to look like big cats 🐅 meet my latest Charlie the King Cheetah , no cc painted in create a pet ❤️",,0.99,5392,0,5392
Sims4,i love the evening mood in Sulani ! 😍 this house has been build by myself !,,0.98,5264,0,5264
Sims4,My wedding guests autonomously sat together with their matching umbrellas and I love it! 🥰,,0.99,5181,0,5181
Sims4,i hate when someone charges for their cc and it looks like this smh,,0.97,5057,0,5057
Sims4,Underwater jungle house surrounded by alligators!!! I love the new update! 😍,,0.99,4857,0,4857
Sims4,One of my favorite parts of this game is watching my sims age and changing up their appearances as they get older.,,1.0,4847,0,4847
Sims4,"Because I hate myself, I made all of my teen sims four different looks for four different years of high school","Natalie, Kennedy, Bianca, Sam, and Stephanie",0.99,4801,0,4801
Sims4,I love making gardens that feel a little overgrown,,0.99,4781,0,4781
Sims4,I love building pretty English cottages.,,0.99,4776,0,4776
Sims4,You can make almost any window into a bay window now and I love it,,0.99,4658,0,4658
Sims4,Hi I play Sims and I like painting so I put them both together. My friends are about to have twins so I thought nursery paintings would he appropriate for my first one :) they're so cute!!,,0.98,4645,0,4645
Sims4,"I gave Malcolm a makeover for storytelling purposes because i like the idea of him growing up with an attitude of a real winner with a very high opinion of himself (way too high, but also low - irresistible but not ever loved for himself, only money or influence)",,0.97,4632,0,4632
Sims4,"I love that my children can inherit traits from their parents, but I am little weirded out that my infant got ""fertile."" Like, what? 💀",,0.99,4557,0,4557
Sims4,No matter how much I love your choice I will roast you,,0.94,4403,0,4403
Sims4,This is the longest any build has ever taken but idc I love it,,0.99,4368,0,4368
Sims4,Ive seen a bunch of people saying this game is supposed to be scrabble. It is clearly dominos...,,0.99,4349,0,4349
Sims4,I didn't know this was an unpopular opinion but i absolutely agree. I love the sims 4 art style,,0.97,4317,0,4317
Sims4,"every time I make new sim, I like them until I see them in portrait &gt;&lt;",,0.99,4206,0,4206
Sims4,"I made 1 sim, 3 versions, same game! I love all the different ways people approach this game and their sims. Play how you play, like what you like, just don’t bash others on how they choose to play. The sim gurus don’t care how you play at all! They just want your money. 😂(Jk)",,0.97,4049,0,4049
Sims4,Ah yes I love bills,,0.99,4039,0,4039
Sims4,Not sure if this is an Unpopular Opinion or not- But I wish the sims four wasn't so damn tech based!,"I get it, it's meant to be a modern game. I just wish I could play a more ""historically ambiguous"" save without everyone whipping out their phones  :'/ or having to use the computer to do everything, or having to use the phone to even get things like a job- Ugh! I wish there were still newspapers or at least some kind of alternative to this, besides off the grid, which is too much of a pain to bother with. Sometimes It really breaks the immersion in a save!",0.98,3940,0,3940
Sims4,I love how the sunlight and shadow in Sims4 makes everything look more cozy,,0.99,3883,0,3883
Sims4,When you knit a poor quality octopus it can turn out like this and I love it,,1.0,3869,0,3869
Sims4,I love this feature so much 😭,,1.0,3861,0,3861
Sims4,"I like this idea of a Sim who wanted to live in a Greenhouse made of reused wood and windows. Wasn't sure for a while, but I kind of like it.",,0.99,3779,0,3779
Sims4,I love the moments I realize I never finished a sim’s outfits,,0.99,3649,0,3649
Sims4,"Hello everyone 🤗 I'm new here, my name is Giulia and I love to build in The Sims 4! Here's an autumnal family home I built a couple weeks ago! Let me know your thoughts :)",,0.99,3594,0,3594
Sims4,"A kitty sized Lioness I painted in CAS, I love how she turned out ♡",,0.98,3577,0,3577
Sims4,Magically Preserving My Son's Future Wife. This Game Is So Messed Up...,"So it just hit me what I've actually been doing, and I gotta admit its pretty messed up.

Been doing a legacy game and the current generation is an immortal Spellcaster husband and a Vampire wife.  Wife is a celebrity, and ended up having one of the random generated townie Paparazzi being really cute.  Least I assume she's a random townie, as her name doesn't have any results when I google it.

So we befriended the cute paparazzi girl, and the spellcaster has given her a Potion of Rejuvenation several times to keep her in Young Adult just so she could hang around for a while.  If it tells you anything about how long its been, Olivia Kim-Lewis is a full on Adult in the save at this point and the other random paparazzi died of old age already.  Along the way, he turned her into a spellcaster.

Well, my sims just had their kid, a boy, and I'm going ""Hey, this will be perfect.  Just one or two more rejuvs and the ages should line up so the kid can marry her!  She's already besties with the family, she appears to have good genetics, and she's already a spellcaster, this will be great!""

Then it kind of hit me.  I've been magically stopping this woman from aging for like 40 years already, and gonna be another 20 years before my kid is old enough to marry her.  She would have been in her 20's when she first generated.

My freshly minted 18 year old son is going to be marrying an 80 year old thats been kept in magic tupperware to preserve freshness.

That is messed up.  Still going to do it, don't get me wrong, but man.",1.0,3539,0,3539
Sims4,"I tried a new build style &amp; I love how it turned out - no CC used , a little Flower shop , thoughts ?",,0.99,3455,0,3455
Sims4,i hate it....,,0.99,3439,0,3439
Sims4,I love when the sims wear my CC lmao,,0.99,3402,0,3402
Sims4,"I‘v tried to recreate this, and I love the way it turned out",,0.99,3401,0,3401
Sims4,Every single townie is generating with this same CC hair 😭😭 It's so funny but I hate it,,1.0,3340,0,3340
Sims4,Unpopular Opinion: we don't need cars.,I was watching pixalade's recent video about the new pack and he was talking about how people were noticing that the way the sidewalks are designed and how it indicated cars and how that theory was shot down by someone on the Sims team and how upsetting it was etc. I couldn't help but think of how much of a non-issue it is. Like...cars would still be rabbit holes with the current mechanics of the game. I don't think it's that big a deal we don't have them. I do like that they're making it easier to build driveways and stuff because of aesthetics but am I the only one who doesn't see the point or think it's a big deal? I'd much rather the Sims team fix current issues and put out worthwhile game play then add a rabbit hole that isn't really important for game play.,0.96,3158,0,3158
Sims4,"I love this new sim, I can’t wait to make her a uni drop out.",,0.98,3108,0,3108
Sims4,I fell in love with a weird painting my sim made and my husband painted me his take on it. I love it so much and how weird it is!,,0.99,3069,0,3069
Sims4,I hate sand,,0.99,3071,0,3071
Sims4,I love some of the descriptions,,1.0,3037,0,3037
Sims4,ok but i love and appreciate the fact that there’s an option to take pics w your pet &lt;3,,0.99,3033,0,3033
Sims4,"i struggle with liking the houses i build, but finally i finished something i like, it’s on the gallery (gallery id: ParmesanGoldfish)",,0.99,2968,0,2968
Sims4,"little nook i made and feeling proud of, i know it’s nothing much but i love it.",,1.0,2968,0,2968
Sims4,"I love using certain everyday/formal dresses as sleepwear, they look better than the actual nightgowns available. Anyone else?",,0.99,2952,0,2952
Sims4,A pool hack I just learnt that I love!,,1.0,2935,0,2935
Sims4,My vampire sim and her deceased soulmate finding each other again in eternal life. I like how her missing reflection adds to the haunted vibe.,,1.0,2841,0,2841
Sims4,Unpopular Opinion (maybe) I hate all the llama crap in this game.,,0.92,2839,0,2839
Sims4,"and it's never behind a sneaky paywall or adfly link, because i hate them myself 🤣",,0.99,2733,0,2733
Sims4,"tbh, unpopular opinion maybe, but horse ranch should have been a game pack","i can see it working better as a strangerville type game pack, again my personal opinion but it doesn’t seem like there’s enough there to make it worth the $40 as an expansion pack.",0.92,2710,0,2710
Sims4,Hello ! This is my new creation : Family Mountain Lodge ⛰🏠 I love so much forest house 😍,,0.99,2680,0,2680
Sims4,A WIP of my Stardew Valley inspired farm! It was challenging to find a good way to mix the styles of both games. I love it so far!,,1.0,2657,0,2657
Sims4,"Meet Esther, my new teen sim. I like how she turned out :)",,0.99,2636,0,2636
Sims4,"Anyone else making their teen sims have bad makeup and terrible style, especially right after birthday? I like to keep them a bit more realistic.",,0.99,2536,0,2536
Sims4,"As much as I love this pronouns update, all the joke posts are really giving me “I identify as an attack helicopter” vibes",I know they’re just jokes most likely by other queer people but I can’t help but feel a bit disheartened by all of these posts as a non-binary person who has been subjected to too many of these “jokes” in the past.,0.75,2521,0,2521
Sims4,I have filled Ridgeline Drive in Newcrest with basegame houses. I love how it’s turned out and wanted to share. Happy holidays!,,0.99,2522,0,2522
Sims4,I hate this sm. Details in comments.,,0.98,2513,0,2513
Sims4,I think she is stunning! One of my favorite things to do in this game is play around with genetics with all my favorite sims to see what i come up with.,,0.98,2467,0,2467
Sims4,Nothing ever goes wrong and I hate it,"I've seen many posts of people talking about how a random event ruined their sims' lives or their plans for the future, but for me the worst that had ever happened was Vlad burning up on one of my Sim's wedding (he was the bride's adoptive father).

At this point I'm not sure if the game is too safe or if it's my micromanaging that's making things go too smooth. I would love to have more risky and unpredictable gameplay, but everything just goes according to plan everytime, making things kinda boring.

Do any of you have the same problem? How do you fix it?",0.99,2465,0,2465
Sims4,Autonomy Is Worse than it's Ever Been and I Hate It,"Look. I love this game. This is VERY rare for me to complain about it because I'm a ""glass half full"" type of Simmer, but this... this is really, really really really infuriating.

I love infants. I really, genuinely do. I love everything about the concepts, the gameplay, the milestones. I love playing with them. I create new saves with single parents just so I can re-experience them again.

But the autonomy of adult sims is MADDENING, and not just with infants, but now with toddlers too.

I'm VERY good at micro-managing. I never ever play with autonomy off (and even if I wanted to it doesn't actually disable any autonomy to do with infants, I have tested this) and I do REALLY good with keeping up needs and controlling all sims to a T and making the most of each day. I'm REALLY good at it.I leave autonomy on so I can sometimes just focus on one sim, or the children, and the adults can do whatever they want without standing still and slowly dying.

The changes to Autonomy absolutely are ruining everything.

I'll queue up the following steps:

1. Change infant diaper
2. Put infant in high chair
3. Give infant carrots

My sim will:

1. Pick up infant
2. Put infant on floor
3. Pick infant back up
4. Check infant, erase all other queued items to do so
5. Go downstairs (still hasn't changed diaper)
6. Ignore my desperate pleas to PLEASE STOP
7. Put Infant on floor
8. Play peak-a-boo

The infant is starving, filthy, has a dirty diaper, and I'm actually, in the real world, screaming so loud I'm shocked I haven't woken up my real life toddler. It is INFURIATING. It happens with toddlers too. I'll put food up where the toddlers can reach it and queue them up to grab a plate each, maybe have one do the little potty first while the other grabs a plate.

HERE COMES MOM TO RUIN ABSOLUTELY EVERYTHING BY CANCELING UP ANYTHING AND EVERYTHING I'VE QUEUED FOR HER AND THE TODDLERS BECAUSE SHE AUTONOMOUSLY \*MUST\* CHECK TODDLER.

I hate this. I hate it SO much. I have disabled autonomy for selected sims, and that absolutely has not stopped them from canceling everything I've queued up to ""check infant/toddler"". It's driving me mad. The team REALLY ruined it with this stupid autonomy tweak. Go back, please, for the love of God, GO BACK. I cannot play with autonomy permanently off, I just can't. I like letting sims do whatever for a little while.

Edit: I logged back on a day later and i have over 150 notifications, what have I done lmfao XD",0.99,2457,0,2457
Sims4,"Apparently the everyday makeup applying to all the outfits is a BUG, but I love it",,1.0,2442,0,2442
Sims4,I love this game lol,,1.0,2408,0,2408
Sims4,I made a green kitchen. And I like it. And those are two sentences I never thought I’d type/say/think.,,0.98,2391,0,2391
Sims4,"Ok, I love Slice of Life, but this bothered me so much as a healthcare worker who has put needles in literal thousands of veins. Vaccines are intramuscular, you don’t shoot them up like heroine 😂",,0.99,2390,0,2390
Sims4,"A symphony of Blue &amp; Gold , the new kit Decor to the max - literally stunned how much I love this kit",,0.98,2371,0,2371
Sims4,Unpopular Opinion| Restrict Sims to Their Respective Worlds &amp; Districts!,Y'know what really grinds my gears? When my sim is living in Mt. Komorebi (Which is obviously based on Japan) and seeing Bob Pancakes outta nowhere wandering the streets when that fat bastard lives in Willow Creek! (Which Is modeled after the southern flora of the U.S…..New Orleans presumably) see what I mean? It totally breaks immersion and as well as storytelling when you see these random Sims from other worlds intruding like nobodies business especially when the worlds are modeled after different places AND countries which would imply extensive travel or financial requirements to even get there. It just utterly breaks any kind of realism especially if you're playing multiple households and maybe you don't want specific sims to meet or cross paths that you made but want them to still live another life or scenario or in another world. Like you should ONLY see them wandering the streets of the world they ACTUALLY reside in or another district of the same world. So far I haven't seen anyone complain about it or even create a solution for this annoying system. Which I feel like it's a very easy fix like if the damn game wants NPCs to populate streets then just have it to where NPCs without households wander the streets NOT already established residents living in another world.,0.92,2353,0,2353
Sims4,I love this so much it's not even funny,,0.99,2354,0,2354
Sims4,I HATE LUMP OF CLAY!!!!!!!,,1.0,2338,0,2338
Sims4,I hate these god awful jeorts,,0.99,2331,0,2331
Sims4,"Update : My first Werewolf is all finished , her name is Willow &amp; I think I love her - no CC painted &amp; shaped in CAS",,0.98,2322,0,2322
Sims4,"I love spring and I wanted to build something that reminds me of that season, so I built a charming country home, perfect for a big family! I hope you like it!",,1.0,2317,0,2317
Sims4,"Does anyone else use the foot illumination system from spa day as dividers between sections of flooring?? It does get a little expensive, but I hate seeing just an abrupt shift between tile and wood or concrete.",,1.0,2288,0,2288
Sims4,"PLEASE, this game is so unserious. Tell me why they close up the mother with ELMER'S GLUE?! LMFAO",,0.99,2284,0,2284
Sims4,Oh my gucci my sim’s husband just died and this happened. I love it I’m crying haha,,0.98,2245,0,2245
Sims4,I love that they changed the ghost needs!,Just noticed they changed it so ghost have their own unique needs. Makes a lot more sense than them having the same needs as alive sims ,1.0,2244,0,2244
Sims4,A teen sim ended up coming to our house and we just kinda let her stick around whenever she wants. I like to headcanon that her house life isn’t the best and she uses our home to get away from it all. My female sim is pregnant and she’s so excited &lt;3,,0.99,2223,0,2223
Sims4,"Confession: I love the cheese hair swatch. I love how cartoony and unrealistic it is, I feel like it fits in the game well.",,0.97,2220,0,2220
Sims4,"I hate that these aren't in the dressers category!!! You can't put the clothes without them, and you have to search every time to find them! WHY didn't they put them in the same category??",,0.99,2216,0,2216
Sims4,Possible unpopular opinion about the new Game Pack…,"Like I know this is EA and The Sims, but shouldn’t all these (ok at least a few) wedding features be added to the base game instead? Like I get the appeal of a new world and items, etc, but it’s something that just seems like everyone should be able to enjoy.
Like ok I guess I will just keep getting my sims married in the yard with people doing push ups in the background with disaster townies just because I won’t pay yet another additional fee? Seems ridiculous imo.
Anyway maybe this was just me ranting haha",0.95,2215,0,2215
Sims4,which hair suits her best? theyre both kind of similar but i cant decide which one i like better 😭,,0.97,2142,0,2142
Sims4,"Unpopular opinion but you actually don't have to buy every sims pack/ kit and just because you don't like it , it doesn't make it bad","Do I like kits? No. But just because im not interested in it does not mean they're terrible or people who do like them should be shamed . EA keeps coming out with more kits because people are obviously buying them and there is obviously some type of demand for them . Get over it . Some people are console players and do not have the luxury of downloading CC. If you don't like it , literally just do not buy it . Tired of people acting like they're obligated and have a gun to their head to buy packs / kits they don't like . If it doesn't interest you or you think £5 ( the cost of a drink ) is too expensive then here's an idea, don't buy it :)",0.87,2120,0,2120
Sims4,i hate sending my sims to a lovely restaurant dinner at 12PM only to finally get served at 12AM,,0.99,2097,0,2097
Sims4,I HATE when my Sims have specific interests,"I know you guys know what I mean? The most common one is when they are obsessed with the family computer, right? There are many others I hate and want to rant about!

The stereo - seriously, half the time when I can’t find them, they are dancing in front of that damn radio. And the toddlers dance in front of it and get mad at dancing! I have to turn it off multiple times just to get them to do their tasks.

The bar - it kills me when they go to the bar in an Inspired mood. They not only go and make a drink, they make multiple drinks! About half a dozen and don’t even drink them! Sometimes I don’t even notice them there and then I start having them clean up and there’s about 8 cups of expired drinks.

Popcorn machine - I swear as soon as they are hungry, they ALWAYS start popping some popcorn. I try to make them dinner and the kids or the spouse is coming to the counter for the popcorn! 

Coffee - in the same framework as above, the coffee machine irks me. It would be the middle of their night and they are obviously tired so I click on their sleep icon and you would think they would go to sleep, right? WRONG! THEYRE GOING TO GET COFFEE! WHY!!!

That giant microscope - I don’t even have any science career sims this time and they keep going to that thing when in a Focused mood. Like, give that thing a break! 

The pool - it’s fine in the summer but in the winter? When it’s snowing in game? Nothing raises my blood pressure more than seeing their icon turn blue and I look out to see them SWIMMING IN THE WINTER! And then I try to rush them in, they lag and die. 

That’s all for now. Thanks for letting me rant.",0.99,2088,0,2088
Sims4,I like how all the criminals at the police station are Elders...what did they do??,,0.99,2054,0,2054
Sims4,unpopular opinion: i’m very excited about the new update specifically this upcoming scenario! im down for some forced proximity &amp; enemies to lovers,,0.99,2049,0,2049
Sims4,I hate when random sims come and harvest my plants. it's stealing!,,0.99,2020,0,2020
Sims4,I HATE the randomised work outfits. My sims works as a Style Influencer and THIS is what she wears to work. . .,,0.99,2008,0,2008
Sims4,Unpopular opinion: I regret getting the seasons pack,"I waited years to get the seasons pack because it was just out of my price range, so when I got a gift card I was SO excited to finally get seasons. I was… disappointed. Sure, building snowmen and playing in the rain are cute actions, but so much of the pack is just annoying. Like, I feel like plants are never in season long enough to make the most of them, and I feel like there’s a holiday every other day (yes, I’ve edited the calendar to have fewer holidays but still). 

It’s probably just my personal play style, but I feel like the only thing I really like about seasons is that there’s weather. 

Am I alone in being underwhelmed/peeved?",0.95,1962,0,1962
Sims4,My Sims 4 flaw is adding too many windows. I like natural light but this just seems uncanny and it honestly scares me,,0.99,1939,0,1939
Sims4,Whoever is responsible for THIS. I hate you from the bottom of my heart!,,0.98,11976,0,11976
Sims4,"So I love making above ground pools, and I don't know why I’m just NOW using the new ladders for them. They go perfectly!",,0.98,9688,0,9688
Sims4,"I LOVE yesterday's update. First build with the new basegame swatches, this is all basegame! :D",,1.0,8168,0,8168
Sims4,"I built this lighthouse for a retired sailor, his writer wife and their children and I like to think they're very happy there",,0.99,7772,0,7772
Sims4,I love the new High Maintenance trait :'),,0.98,7463,0,7463
Sims4,I love to live vicariously through my sims,,0.97,6964,0,6964
Sims4,The fact that these two different birds can coexist together in this game is just hilarious,,1.0,6901,0,6901
Sims4,"I don't remember who posted giving the idea of half walls with a curtain as an entry way, but I did it, and I love it.",,0.98,6721,0,6721
Sims4,I love the fact that we can name our own songs,,0.99,5987,0,5987
Sims4,Unpopular Opinion: I hate hot townie makeovers. I want them all to look like they are two steps away from disaster.,"Yes, that jawline could cut glass and those eyes glisten like stars scattered over the gently shimmering water of a cool lagoon...

Straight to jail. 

I want my townies pear-shaped, chinless and wearing ski boots and a bridal veil to the library. I want Judith Ward to show up at an awards ceremony married to a hot dog with purple hair and no teeth. I want Vlad and his seven cats to walk past my house in speedos and a wrestling mask. 

Say no to yassification. Say YES to free spirits.

(I mean, obviously play how you want to play. For me, a lot of the fun is the chaos that randomly generates.)",0.98,5724,0,5724
Sims4,"Sometimes...I never like how the stairs are arranged in the game, but I like to improvise it like this lol",,0.99,5566,0,5566
Sims4,I love this photo my Sim took of his wife on their wedding day. Gosh darn it. 🥺❤️,,0.99,5521,0,5521
Sims4,Did my best 😊 but i like it !,,0.98,5459,0,5459
Sims4,"I like to paint dogs to look like big cats 🐅 meet my latest Charlie the King Cheetah , no cc painted in create a pet ❤️",,0.99,5391,0,5391
